_id,title,content,author_id,category,publication_date
68f6d22d4d3456f5d4cebea4,The Future of Quantum Computing,"Quantum computing represents a fundamental shift from the classical computers we use today. Instead of bits, which can be either a 0 or a 1, quantum computers use qubits. A qubit can exist as a 0, a 1, or both simultaneously in a state of superposition. This property, along with entanglement, allows quantum computers to process a massive number of calculations at once. The potential applications are staggering, from creating new medicines to developing unbreakable encryption. While we are still in the early days, major companies and research institutions are investing heavily in this technology. The challenges are immense, involving qubit stability and error correction. However, the progress being made is accelerating rapidly. The world is on the cusp of a new computational era that will redefine problem-solving.",68f6cf587534c3ee82cebea5,Technology,2025-10-22T14:00:00.000Z
68f6d22d4d3456f5d4cebea5,Is Artificial Intelligence Overhyped?,"Artificial intelligence is dominating headlines, with promises to reshape every industry. From generative art to autonomous vehicles, its capabilities are expanding at an unprecedented rate. However, it's important to separate the hype from reality. While AI excels at specific, narrow tasks, the dream of Artificial General Intelligence (AGI) remains a distant one. Current models are powerful pattern-recognition machines, but they lack true understanding or consciousness. There are also significant ethical concerns regarding bias, privacy, and job displacement that need to be addressed. The energy consumption of training large AI models is another major challenge for sustainability. As consumers and developers, we must approach AI with a critical mindset. It is a transformative tool, but it is not a magical solution to all problems. Thoughtful implementation and regulation are essential to harness its benefits responsibly.",68f6cf587534c3ee82cebea5,Technology,2025-10-15T11:00:00.000Z
68f6d22d4d3456f5d4cebea6,"Hidden Gems of Kyoto, Japan","While most tourists flock to the famous Golden Pavilion and Fushimi Inari shrine, Kyoto is full of lesser-known treasures. One such place is the serene Otagi Nenbutsu-ji Temple, home to over 1,200 unique and whimsical stone statues. Another hidden gem is the Gekkeikan Okura Sake Museum, where you can learn about the history of sake brewing and enjoy some tastings. For a peaceful walk away from the crowds, the Philosopher's Path is especially beautiful during cherry blossom season. Don't miss out on Nishiki Market, a bustling five-block long shopping street known as 'Kyoto's Kitchen.' Here you can sample local delicacies from pickled vegetables to fresh sashimi. The nearby Ponto-chō alley offers a glimpse into traditional nightlife with its narrow lane of exclusive restaurants. Exploring these spots offers a more authentic and intimate experience of this historic city. It's a reminder that the best travel memories are often made off the beaten path. You'll leave with a deeper appreciation for the culture.",68f6cf587534c3ee82cebea6,Travel,2025-07-10T15:30:00.000Z
68f6d22d4d3456f5d4cebea7,Backpacking Through Patagonia,"Patagonia, a region at the southern tip of South America, is a paradise for hikers and nature lovers. Its dramatic landscapes of jagged peaks, massive glaciers, and turquoise lakes are truly awe-inspiring. Our journey focused on the famous 'W' Trek in Chile's Torres del Paine National Park. The trek is challenging but rewards you with iconic views of the granite towers and the vast Grey Glacier. The unpredictable weather is part of the adventure; we experienced sunshine, rain, and powerful winds all in a single day. Another highlight was crossing into Argentina to see the Perito Moreno Glacier, a colossal river of ice that is constantly calving. From the town of El Chaltén, we hiked to the base of the legendary Mount Fitz Roy. The raw, untamed beauty of this region is humbling. It’s a place that makes you feel small in the best way possible. This trip requires good physical preparation but is an unforgettable experience for any adventurer.",68f6cf587534c3ee82cebea6,Travel,2025-09-05T18:00:00.000Z
68f6d22d4d3456f5d4cebea8,The Rise of Phishing-as-a-Service,"Phishing attacks have become more sophisticated, partly due to the emergence of Phishing-as-a-Service (PhaaS) platforms. These services operate like legitimate software businesses, offering toolkits and templates to aspiring cybercriminals. This has significantly lowered the barrier to entry, allowing individuals with minimal technical skills to launch convincing phishing campaigns. PhaaS kits often include pre-made email templates, fake login pages for popular services, and systems for managing stolen credentials. Some even offer customer support to their malicious clients. The primary defense against these attacks remains user education and vigilance. Employees should be trained to spot red flags like suspicious sender addresses, urgent language, and unexpected attachments. Implementing multi-factor authentication (MFA) is one of the most effective technical controls, as it prevents account takeover even if credentials are stolen. Organizations must adopt a layered security approach to combat this evolving threat. The democratization of cybercrime tools means we must be more proactive than ever.",68f6cf587534c3ee82cebec3,Cybersecurity,2025-10-17T22:00:00.000Z
68f6d22d4d3456f5d4cebea9,What is Zero Trust Security?,"The traditional security model of a strong perimeter, often called the 'castle-and-moat' approach, is no longer effective in today's world of remote work and cloud services. This is where the Zero Trust security model comes in. Its core principle is simple: 'never trust, always verify.' Instead of assuming that everything inside the corporate network is safe, Zero Trust assumes that threats exist both inside and outside the network. Access to resources is granted on a per-session basis and is strictly enforced. Authentication and authorization are performed for every access request, regardless of where it originates. This model relies heavily on technologies like identity and access management (IAM), multi-factor authentication (MFA), and micro-segmentation. Micro-segmentation breaks the network into small, isolated zones to limit the lateral movement of an attacker. Adopting a Zero Trust architecture is a strategic shift that enhances security posture significantly. It's a journey, not a destination, requiring continuous monitoring and adaptation.",68f6cf587534c3ee82cebec3,Cybersecurity,2025-09-29T12:15:00.000Z
68f6d22d4d3456f5d4cebeaa,The Power of WebAssembly,"For a long time, JavaScript was the only language that could run natively in web browsers. However, WebAssembly (or Wasm) is changing that paradigm. Wasm is a low-level, binary instruction format that provides a way of running code written in other languages, like C++, Rust, and Go, on the web. It is designed to be a compilation target, not for developers to write directly. This allows for near-native performance for computationally intensive tasks, such as gaming, video editing, and data visualization, right in the browser. WebAssembly runs in the same sandboxed environment as JavaScript, ensuring it is secure. It is not meant to replace JavaScript but to complement it. Developers can use JavaScript for handling user interactions and the DOM, while offloading heavy processing to a WebAssembly module. The interoperability between the two is seamless. This technology is opening up a new world of possibilities for rich, powerful web applications. It's a game-changer for the future of web development.",68f6cf587534c3ee82cebec4,Web Development,2025-10-18T10:00:00.000Z
68f6d22d4d3456f5d4cebeab,State Management in Modern Frontend Frameworks,"As web applications grow in complexity, managing their 'state' becomes one of the biggest challenges. State is essentially any data that can change over time, such as user input, server responses, or UI elements. Modern frameworks like React, Vue, and Svelte offer different solutions to this problem. React popularized the concept of a virtual DOM and one-way data flow. For complex applications, libraries like Redux or Zustand are often used to manage a global state outside of the components. Vue provides a more built-in reactivity system and a centralized state management pattern through Pinia. Svelte takes a different approach by moving the work to a compile step, resulting in highly efficient code that updates the DOM surgically. Each approach has its own trade-offs in terms of boilerplate, performance, and learning curve. Choosing the right state management strategy is crucial for building scalable and maintainable applications. It's a key decision that impacts the entire architecture of a frontend project.",68f6cf587534c3ee82cebec4,Web Development,2025-09-25T16:45:00.000Z
68f6d22d4d3456f5d4cebeac,The Art of Digital Minimalism,"In a world saturated with notifications and digital noise, digital minimalism offers a path to a more focused and intentional life. It's not about rejecting technology entirely but about curating your digital life with purpose. The first step is to conduct a digital declutter, removing apps and unsubscribing from services that don't provide significant value. Then, reintroduce technology on your own terms, setting clear rules for its use. This might involve turning off all non-essential notifications or scheduling specific times for checking social media. The goal is to reclaim your time and attention from the persuasive design of modern apps. Solitude is another key aspect, allowing your mind to process thoughts without constant external input. By being more deliberate about our technology use, we can reduce anxiety and improve our ability to concentrate. It's a philosophy that encourages us to live a more present life. Digital minimalism empowers you to be the master of your technology, not the other way around.",68f6cf587534c3ee82cebeaa,Lifestyle,2025-10-16T09:30:00.000Z
68f6d22d4d3456f5d4cebead,Benefits of Waking Up Early,"The idea of waking up early might seem daunting, but it offers numerous benefits for both productivity and well-being. The quiet morning hours provide an uninterrupted block of time for focused work, exercise, or meditation. This peaceful start can set a positive tone for the entire day. Biologically, waking up early aligns our bodies with their natural circadian rhythms, which can lead to better sleep quality at night. Many successful people attribute their success to their early morning routines. It gives them a chance to plan their day and tackle their most important tasks before distractions arise. The feeling of accomplishment before most people have even started their day is a powerful motivator. Of course, this habit requires discipline and a consistent bedtime. It's about shifting your entire schedule, not just sacrificing sleep. If you want to take control of your day, try waking up just 30 minutes earlier and see the difference it makes. You'll likely find it to be a transformative habit.",68f6cf587534c3ee82cebeaa,Lifestyle,2025-09-12T08:00:00.000Z
68f6d22d4d3456f5d4cebeae,The Science of a Perfect Pizza Dough,"Creating a perfect pizza dough is both an art and a science, revolving around four simple ingredients: flour, water, yeast, and salt. The type of flour is critical; a '00' flour is finely milled and provides the classic Neapolitan crust. The hydration level, or the ratio of water to flour, determines the texture of the final crust. A higher hydration dough is harder to handle but results in a lighter, airier crumb. The magic happens during fermentation, where yeast consumes sugars and produces carbon dioxide, causing the dough to rise. A long, cold fermentation in the refrigerator for 24 to 72 hours develops complex flavors that a quick rise cannot achieve. Salt plays a dual role: it adds flavor and also controls the yeast's activity, preventing it from over-fermenting. Kneading the dough develops the gluten network, which gives the crust its structure and chewiness. Finally, a very hot oven is essential for achieving the 'oven spring' that puffs up the crust. Mastering these variables is the key to a truly exceptional homemade pizza.",68f6cf587534c3ee82cebeb6,Food,2025-10-14T19:30:00.000Z
68f6d22d4d3456f5d4cebeaf,Exploring the World of Fermented Foods,"Fermentation is an ancient technique of food preservation that is experiencing a modern renaissance. It is a metabolic process in which microorganisms like bacteria and yeast convert carbohydrates into alcohol or organic acids. This process not only preserves the food but also creates distinctive flavors, aromas, and textures. Think of the tangy taste of sauerkraut, the fizz of kombucha, or the savory depth of miso. Beyond flavor, fermented foods are rich in probiotics, which are beneficial bacteria that support gut health. A healthy gut microbiome is linked to numerous benefits, including improved digestion, a stronger immune system, and even better mental health. Common fermented foods include yogurt, kefir, kimchi, and sourdough bread. Making your own at home can be a simple and rewarding process. It's a fascinating way to connect with your food and explore a world of complex flavors. The transformative power of microbes is truly a culinary wonder.",68f6cf587534c3ee82cebeb6,Food,2025-08-28T17:00:00.000Z
68f6d22d4d3456f5d4cebeb0,The Mystery of Dark Matter,"One of the most profound puzzles in modern astrophysics is the nature of dark matter. We know it exists because of its gravitational effects on visible matter. Galaxies rotate faster than they should based on the mass of their stars and gas, implying there is unseen mass providing extra gravity. Dark matter is also crucial for explaining the large-scale structure of the universe, acting as the scaffolding upon which galaxies form. Despite its overwhelming evidence, we have not yet directly detected a dark matter particle. Scientists believe it does not interact with light or any other form of electromagnetic radiation, hence its name. The leading candidates for dark matter particles are WIMPs (Weakly Interacting Massive Particles). Huge, sensitive detectors have been built deep underground to try and catch a rare interaction of a WIMP with a normal atom. So far, these searches have come up empty. The hunt for dark matter is a thrilling scientific detective story. Unraveling this mystery will reshape our understanding of the cosmos.",68f6cf587534c3ee82cebea7,Science,2025-10-09T23:00:00.000Z
68f6d22d4d3456f5d4cebeb1,How CRISPR is Changing Gene Editing,"The discovery of CRISPR-Cas9 has been a monumental breakthrough in the field of genetics. It's a powerful and precise tool that allows scientists to edit DNA with unprecedented ease. Originally a defense mechanism found in bacteria, CRISPR acts like a pair of 'molecular scissors.' It can be programmed to find a specific sequence of DNA and then cut it. This allows researchers to remove, add, or alter sections of the DNA sequence. The potential applications are vast, from curing genetic diseases like cystic fibrosis and sickle cell anemia to developing more resilient crops. Of course, this powerful technology also brings significant ethical questions. The possibility of editing human embryos, creating 'designer babies,' raises concerns about unforeseen consequences and social inequality. Careful regulation and public discourse are essential to guide its development. Despite the challenges, CRISPR is already revolutionizing biological research. It stands as one of the most significant scientific discoveries of the 21st century.",68f6cf587534c3ee82cebea7,Science,2025-09-19T10:30:00.000Z
68f6d22d4d3456f5d4cebeb2,Understanding Compound Interest,"Compound interest has been called the eighth wonder of the world, and for good reason. It is the process where the interest on your investment earns interest on itself. This creates a snowball effect that can dramatically grow your wealth over time. The key ingredients are the principal amount, the interest rate, and, most importantly, time. The longer your money is invested, the more powerful compounding becomes. This is why it's so beneficial to start saving and investing as early as possible. Even small, regular contributions can grow into a substantial sum given enough time to compound. It is the fundamental principle behind long-term investing strategies for retirement, such as contributing to a 401(k) or an IRA. Understanding this concept is the first step toward financial literacy. It shifts your mindset from simply saving money to making your money work for you. It's a patient game, but the rewards are well worth the wait.",68f6cf587534c3ee82cebebd,Finance,2025-10-01T13:00:00.000Z
68f6d22d4d3456f5d4cebeb3,The Importance of Sleep for Mental Health,"Sleep is not a luxury; it is a biological necessity that is fundamental to our mental and emotional health. During sleep, our brains work to process information, consolidate memories, and clear out metabolic waste products that accumulate during waking hours. Chronic sleep deprivation can have severe consequences for our cognitive function. It can impair attention, concentration, and decision-making abilities. Furthermore, there is a strong link between poor sleep and mental health disorders like anxiety and depression. Lack of sleep can amplify the brain's anticipatory reactions, increasing levels of anxiety. It also affects the regulation of emotions, making us more prone to irritability and mood swings. To improve sleep quality, it's important to practice good sleep hygiene. This includes maintaining a consistent sleep schedule, creating a relaxing bedtime routine, and ensuring your bedroom is dark, quiet, and cool. Prioritizing sleep is one of the most effective forms of self-care. It's a critical investment in your overall well-being and resilience.",68f6cf587534c3ee82cebec8,Health,2025-10-13T09:00:00.000Z
68ff807f1e3b338e31db28da,The Zero Move,"In cybersecurity, defense usually means building walls, filters, and monitors designed to keep attackers out. But what if security was reimagined to be offensive from the very first interaction - so that even the earliest probing and reconnaissance phases trigger active countermeasures, protecting the system by disrupting the attacker?\r\nI know this sounds abstract, maybe even impossible or illogical at first glance. But this idea - a security model built solely on offensive activities, triggered immediately when an attacker steps onto your system - is worth exploring.\r\nA Working System That Answers Differently\r\nThis is not a fake environment or an elaborate honeypot. This is a real, functioning system, serving legitimate users and applications.\r\nBut the key difference is how it responds to any reconnaissance or scanning attempt:\r\ni) The system intelligently alters or manipulates scan responses, feeding the attacker misleading or even malicious data.\r\nii) For example, a simple port scan or directory enumeration doesn't get normal answers - it might get crafted responses designed to exploit weaknesses in the attacker's scanning tools or frameworks.\r\niii) These responses can carry hidden payloads or subtle exploits that infect the attacker's system or degrade their capabilities.\r\nIn this way, even the earliest phase of an attack - the reconnaissance - becomes a dangerous step for the attacker.\r\n\r\nTraps Within, But Not the Whole System\r\nIf an attacker manages to move beyond scanning and gains some form of access, then they enter a part of the environment that is heavily fortified with traps:\r\ni) Files, executables, or services in these deeper zones are often weaponized with malware or countermeasures that target the attacker's machine or network.\r\nii) But these traps are only part of the system - the whole environment isn't hostile, it's a carefully balanced mix of real functionality and offensive security measures.\r\nIntelligence: Enhancer, Not Foundation\r\nIntelligence is extremely important - it allows the system to:\r\ni) Recognize attacker patterns quickly\r\nii) Tailor malicious responses dynamically for maximum effect\r\niii) Adapt as attackers change tactics\r\nHowever, this security model does not rely solely on intelligence to exist. The core idea is that the system's offensive capability is built into the very responses themselves. Intelligence makes these responses smarter and more effective but isn't what makes the security possible.\r\n\r\nThe Challenge of Protecting the CIA Triad\r\nNo matter how clever the offensive measures, maintaining confidentiality, integrity, and especially availability remains incredibly challenging:\r\ni) The system must never disrupt legitimate users or processes - altering responses to attackers must be done carefully to avoid accidental service issues.\r\nii)Availability is particularly tricky - automated, offensive countermeasures running on reconnaissance traffic risk unintended consequences if not perfectly controlled.\r\niii) Protecting confidentiality and integrity requires careful segmentation and isolation so attackers never reach real sensitive data or services.\r\nThis challenge makes building such a security system extremely difficult in practice.\r\n\r\nWhy This Matters?\r\nEven though this purely offense-based security model faces serious hurdles, it's a powerful idea that challenges traditional thinking:\r\ni) What if the first step an attacker takes on your system already makes their entire attack futile or self-destructive?\r\nii) What if the system doesn't just defend but actively protects itself by weaponizing its very responses?\r\nThis flips the classic defender-attacker balance, making security not just about shielding but about turning the attacker's own tools against them - right from the start.",68ff7eca1449054560e33a04,CyberSecurity,2025-12-02T22:02:57.897Z
